{"batches":[{"batchOrdinal":1,"invalidOutputCount":0,"itemCount":32,"stage":"Luna","verdicts":{"CORRECT":11,"UNSURE":2,"WRONG":19}},{"batchOrdinal":2,"invalidOutputCount":0,"itemCount":32,"stage":"Luna","verdicts":{"CORRECT":11,"UNSURE":0,"WRONG":21}},{"batchOrdinal":3,"invalidOutputCount":0,"itemCount":32,"stage":"Luna","verdicts":{"CORRECT":8,"UNSURE":0,"WRONG":24}},{"batchOrdinal":4,"invalidOutputCount":0,"itemCount":32,"stage":"Luna","verdicts":{"CORRECT":13,"UNSURE":4,"WRONG":15}},{"batchOrdinal":5,"invalidOutputCount":0,"itemCount":32,"stage":"Luna","verdicts":{"CORRECT":15,"UNSURE":0,"WRONG":17}},{"batchOrdinal":6,"invalidOutputCount":0,"itemCount":32,"stage":"Luna","verdicts":{"CORRECT":16,"UNSURE":1,"WRONG":15}},{"batchOrdinal":7,"invalidOutputCount":0,"itemCount":32,"stage":"Luna","verdicts":{"CORRECT":13,"UNSURE":3,"WRONG":16}},{"batchOrdinal":8,"invalidOutputCount":0,"itemCount":32,"stage":"Luna","verdicts":{"CORRECT":9,"UNSURE":1,"WRONG":22}},{"batchOrdinal":9,"invalidOutputCount":0,"itemCount":32,"stage":"Luna","verdicts":{"CORRECT":10,"UNSURE":2,"WRONG":20}},{"batchOrdinal":10,"invalidOutputCount":0,"itemCount":32,"stage":"Luna","verdicts":{"CORRECT":14,"UNSURE":0,"WRONG":18}},{"batchOrdinal":11,"invalidOutputCount":0,"itemCount":32,"stage":"Luna","verdicts":{"CORRECT":7,"UNSURE":1,"WRONG":24}},{"batchOrdinal":12,"invalidOutputCount":0,"itemCount":32,"stage":"Luna","verdicts":{"CORRECT":11,"UNSURE":1,"WRONG":20}},{"batchOrdinal":13,"invalidOutputCount":0,"itemCount":32,"stage":"Luna","verdicts":{"CORRECT":9,"UNSURE":0,"WRONG":23}},{"batchOrdinal":14,"invalidOutputCount":0,"itemCount":32,"stage":"Luna","verdicts":{"CORRECT":13,"UNSURE":0,"WRONG":19}},{"batchOrdinal":15,"invalidOutputCount":0,"itemCount":32,"stage":"Luna","verdicts":{"CORRECT":19,"UNSURE":1,"WRONG":12}},{"batchOrdinal":16,"invalidOutputCount":0,"itemCount":32,"stage":"Luna","verdicts":{"CORRECT":9,"UNSURE":0,"WRONG":23}},{"batchOrdinal":17,"invalidOutputCount":0,"itemCount":32,"stage":"Luna","verdicts":{"CORRECT":13,"UNSURE":1,"WRONG":18}},{"batchOrdinal":18,"invalidOutputCount":0,"itemCount":32,"stage":"Luna","verdicts":{"CORRECT":17,"UNSURE":2,"WRONG":13}},{"batchOrdinal":19,"invalidOutputCount":1,"itemCount":32,"stage":"Luna","verdicts":{"CORRECT":0,"UNSURE":32,"WRONG":0}},{"batchOrdinal":20,"invalidOutputCount":0,"itemCount":32,"stage":"Luna","verdicts":{"CORRECT":9,"UNSURE":2,"WRONG":21}},{"batchOrdinal":21,"invalidOutputCount":0,"itemCount":24,"stage":"Luna","verdicts":{"CORRECT":11,"UNSURE":1,"WRONG":12}},{"batchOrdinal":1,"invalidOutputCount":0,"itemCount":16,"stage":"Terra","verdicts":{"CORRECT":8,"UNSURE":3,"WRONG":5}},{"batchOrdinal":2,"invalidOutputCount":0,"itemCount":16,"stage":"Terra","verdicts":{"CORRECT":8,"UNSURE":0,"WRONG":8}},{"batchOrdinal":3,"invalidOutputCount":0,"itemCount":16,"stage":"Terra","verdicts":{"CORRECT":6,"UNSURE":4,"WRONG":6}},{"batchOrdinal":4,"invalidOutputCount":0,"itemCount":16,"stage":"Terra","verdicts":{"CORRECT":9,"UNSURE":1,"WRONG":6}},{"batchOrdinal":5,"invalidOutputCount":0,"itemCount":16,"stage":"Terra","verdicts":{"CORRECT":10,"UNSURE":2,"WRONG":4}},{"batchOrdinal":6,"invalidOutputCount":0,"itemCount":16,"stage":"Terra","verdicts":{"CORRECT":3,"UNSURE":3,"WRONG":10}},{"batchOrdinal":7,"invalidOutputCount":0,"itemCount":16,"stage":"Terra","verdicts":{"CORRECT":6,"UNSURE":0,"WRONG":10}},{"batchOrdinal":8,"invalidOutputCount":0,"itemCount":16,"stage":"Terra","verdicts":{"CORRECT":7,"UNSURE":0,"WRONG":9}},{"batchOrdinal":9,"invalidOutputCount":0,"itemCount":16,"stage":"Terra","verdicts":{"CORRECT":4,"UNSURE":2,"WRONG":10}},{"batchOrdinal":10,"invalidOutputCount":0,"itemCount":16,"stage":"Terra","verdicts":{"CORRECT":7,"UNSURE":0,"WRONG":9}},{"batchOrdinal":11,"invalidOutputCount":0,"itemCount":16,"stage":"Terra","verdicts":{"CORRECT":8,"UNSURE":1,"WRONG":7}},{"batchOrdinal":12,"invalidOutputCount":0,"itemCount":16,"stage":"Terra","verdicts":{"CORRECT":7,"UNSURE":1,"WRONG":8}},{"batchOrdinal":13,"invalidOutputCount":0,"itemCount":16,"stage":"Terra","verdicts":{"CORRECT":5,"UNSURE":1,"WRONG":10}},{"batchOrdinal":14,"invalidOutputCount":0,"itemCount":16,"stage":"Terra","verdicts":{"CORRECT":8,"UNSURE":2,"WRONG":6}},{"batchOrdinal":15,"invalidOutputCount":0,"itemCount":7,"stage":"Terra","verdicts":{"CORRECT":3,"UNSURE":1,"WRONG":3}},{"batchOrdinal":1,"invalidOutputCount":0,"itemCount":8,"stage":"Sol","verdicts":{"CORRECT":4,"UNSURE":3,"WRONG":1}},{"batchOrdinal":2,"invalidOutputCount":0,"itemCount":8,"stage":"Sol","verdicts":{"CORRECT":4,"UNSURE":2,"WRONG":2}},{"batchOrdinal":3,"invalidOutputCount":0,"itemCount":8,"stage":"Sol","verdicts":{"CORRECT":2,"UNSURE":2,"WRONG":4}},{"batchOrdinal":4,"invalidOutputCount":0,"itemCount":8,"stage":"Sol","verdicts":{"CORRECT":4,"UNSURE":2,"WRONG":2}},{"batchOrdinal":5,"invalidOutputCount":0,"itemCount":8,"stage":"Sol","verdicts":{"CORRECT":2,"UNSURE":4,"WRONG":2}},{"batchOrdinal":6,"invalidOutputCount":0,"itemCount":8,"stage":"Sol","verdicts":{"CORRECT":5,"UNSURE":0,"WRONG":3}},{"batchOrdinal":7,"invalidOutputCount":0,"itemCount":8,"stage":"Sol","verdicts":{"CORRECT":2,"UNSURE":2,"WRONG":4}},{"batchOrdinal":8,"invalidOutputCount":0,"itemCount":8,"stage":"Sol","verdicts":{"CORRECT":2,"UNSURE":1,"WRONG":5}},{"batchOrdinal":9,"invalidOutputCount":0,"itemCount":8,"stage":"Sol","verdicts":{"CORRECT":2,"UNSURE":1,"WRONG":5}},{"batchOrdinal":10,"invalidOutputCount":0,"itemCount":8,"stage":"Sol","verdicts":{"CORRECT":3,"UNSURE":1,"WRONG":4}},{"batchOrdinal":11,"invalidOutputCount":0,"itemCount":8,"stage":"Sol","verdicts":{"CORRECT":3,"UNSURE":0,"WRONG":5}},{"batchOrdinal":12,"invalidOutputCount":0,"itemCount":8,"stage":"Sol","verdicts":{"CORRECT":4,"UNSURE":1,"WRONG":3}},{"batchOrdinal":13,"invalidOutputCount":0,"itemCount":2,"stage":"Sol","verdicts":{"CORRECT":0,"UNSURE":2,"WRONG":0}}],"capabilityBoundary":{"invariantWeightsVerified":false,"promptComplianceVerified":false,"providerExecutionVerified":false,"providerFreshnessVerified":false},"cells":[{"advisoryDispositionDeltaCount":13,"advisoryVerdicts":{"CORRECT":30,"UNSURE":0,"WRONG":30},"candidateClass":"correct","lunaTerraDisagreements":2,"lunaVerdicts":{"CORRECT":29,"UNSURE":0,"WRONG":31},"lunaVsIntendedDisagreements":31,"lunaVsV8Disagreements":10,"poolCount":60,"solRouted":2,"solVerdicts":{"CORRECT":1,"UNSURE":0,"WRONG":1},"stratum":"category-1","terraRouted":32,"terraVerdicts":{"CORRECT":3,"UNSURE":0,"WRONG":29}},{"advisoryDispositionDeltaCount":9,"advisoryVerdicts":{"CORRECT":46,"UNSURE":5,"WRONG":9},"candidateClass":"correct","lunaTerraDisagreements":8,"lunaVerdicts":{"CORRECT":44,"UNSURE":7,"WRONG":9},"lunaVsIntendedDisagreements":16,"lunaVsV8Disagreements":12,"poolCount":60,"solRouted":11,"solVerdicts":{"CORRECT":4,"UNSURE":5,"WRONG":2},"stratum":"category-2","terraRouted":18,"terraVerdicts":{"CORRECT":6,"UNSURE":3,"WRONG":9}},{"advisoryDispositionDeltaCount":6,"advisoryVerdicts":{"CORRECT":22,"UNSURE":6,"WRONG":2},"candidateClass":"correct","lunaTerraDisagreements":2,"lunaVerdicts":{"CORRECT":21,"UNSURE":7,"WRONG":2},"lunaVsIntendedDisagreements":9,"lunaVsV8Disagreements":9,"poolCount":30,"solRouted":7,"solVerdicts":{"CORRECT":2,"UNSURE":5,"WRONG":0},"stratum":"category-3","terraRouted":9,"terraVerdicts":{"CORRECT":1,"UNSURE":5,"WRONG":3}},{"advisoryDispositionDeltaCount":7,"advisoryVerdicts":{"CORRECT":49,"UNSURE":3,"WRONG":8},"candidateClass":"correct","lunaTerraDisagreements":5,"lunaVerdicts":{"CORRECT":47,"UNSURE":5,"WRONG":8},"lunaVsIntendedDisagreements":13,"lunaVsV8Disagreements":9,"poolCount":60,"solRouted":7,"solVerdicts":{"CORRECT":4,"UNSURE":1,"WRONG":2},"stratum":"category-4","terraRouted":13,"terraVerdicts":{"CORRECT":4,"UNSURE":2,"WRONG":7}},{"advisoryDispositionDeltaCount":0,"advisoryVerdicts":{"CORRECT":0,"UNSURE":0,"WRONG":60},"candidateClass":"specific-wrong","lunaTerraDisagreements":4,"lunaVerdicts":{"CORRECT":0,"UNSURE":4,"WRONG":56},"lunaVsIntendedDisagreements":4,"lunaVsV8Disagreements":4,"poolCount":60,"solRouted":4,"solVerdicts":{"CORRECT":0,"UNSURE":0,"WRONG":4},"stratum":"category-1","terraRouted":4,"terraVerdicts":{"CORRECT":0,"UNSURE":0,"WRONG":4}},{"advisoryDispositionDeltaCount":0,"advisoryVerdicts":{"CORRECT":0,"UNSURE":0,"WRONG":60},"candidateClass":"specific-wrong","lunaTerraDisagreements":7,"lunaVerdicts":{"CORRECT":0,"UNSURE":7,"WRONG":53},"lunaVsIntendedDisagreements":7,"lunaVsV8Disagreements":7,"poolCount":60,"solRouted":7,"solVerdicts":{"CORRECT":0,"UNSURE":0,"WRONG":7},"stratum":"category-2","terraRouted":7,"terraVerdicts":{"CORRECT":0,"UNSURE":0,"WRONG":7}},{"advisoryDispositionDeltaCount":3,"advisoryVerdicts":{"CORRECT":0,"UNSURE":3,"WRONG":44},"candidateClass":"specific-wrong","lunaTerraDisagreements":3,"lunaVerdicts":{"CORRECT":0,"UNSURE":6,"WRONG":41},"lunaVsIntendedDisagreements":6,"lunaVsV8Disagreements":6,"poolCount":47,"solRouted":6,"solVerdicts":{"CORRECT":0,"UNSURE":3,"WRONG":3},"stratum":"category-3","terraRouted":6,"terraVerdicts":{"CORRECT":0,"UNSURE":3,"WRONG":3}},{"advisoryDispositionDeltaCount":2,"advisoryVerdicts":{"CORRECT":2,"UNSURE":0,"WRONG":58},"candidateClass":"specific-wrong","lunaTerraDisagreements":7,"lunaVerdicts":{"CORRECT":3,"UNSURE":4,"WRONG":53},"lunaVsIntendedDisagreements":7,"lunaVsV8Disagreements":8,"poolCount":60,"solRouted":7,"solVerdicts":{"CORRECT":1,"UNSURE":0,"WRONG":6},"stratum":"category-4","terraRouted":10,"terraVerdicts":{"CORRECT":2,"UNSURE":0,"WRONG":8}},{"advisoryDispositionDeltaCount":8,"advisoryVerdicts":{"CORRECT":19,"UNSURE":1,"WRONG":40},"candidateClass":"vague-topical-wrong","lunaTerraDisagreements":9,"lunaVerdicts":{"CORRECT":23,"UNSURE":2,"WRONG":35},"lunaVsIntendedDisagreements":25,"lunaVsV8Disagreements":10,"poolCount":60,"solRouted":9,"solVerdicts":{"CORRECT":2,"UNSURE":1,"WRONG":6},"stratum":"category-1","terraRouted":30,"terraVerdicts":{"CORRECT":18,"UNSURE":0,"WRONG":12}},{"advisoryDispositionDeltaCount":29,"advisoryVerdicts":{"CORRECT":28,"UNSURE":2,"WRONG":30},"candidateClass":"vague-topical-wrong"